8380,1,"Cystadenoma, endometrioid, borderline malignancy",alternate
8380,1,"Endometrioid cystadenoma, borderline malignancy",alternate
8380,1,Endometrioid tumor of low malignant potential,alternate
8380,1,"Endometrioid tumor, atypical proliferative",alternate
8380,1,"Low malignant potential, endometrioid tumor",alternate
8380,1,"Proliferative endometrioid tumor, atypical",alternate
8380,1,"Tumor, endometrioid of low malignant potential (C56.9)",alternate
8380,1,"Tumor, endometrioid, atypical proliferative",alternate
8380,1,"Adenoma, endometrioid, borderline malignancy",alternate
8380,1,Atypical proliferative endometrioid tumor,alternate
8380,2,Endometrioid intraepithelial neoplasia (C54._) [2018+; REPORTABLE 2021+],preferred
8380,2,Endometrioid intraepithelial neoplasm/Atypical hyperplasia (C54._) [2018+; REPORTABLE 2021+],alternate
8380,2,Endometrioid adenocarcinoma in situ,alternate
8380,2,Atypical hyperplasia of the endometrium (C54._) [2018+; REPORTABLE 2021+],alternate
8380,2,Atypical hyperplasia/Endometrioid intraepithelial neoplasm (C54._) [2018+; REPORTABLE 2021+],alternate
8380,3,Endometrioid adenocarcinoma,preferred
8380,3,"Adenocarcinoma, HPV-independent, endometrioid type [2021+]",alternate
8380,3,"Adenocarcinoma, endometrioid, NOS",alternate
8380,3,"Carcinoma, endometrioid, NOS",alternate
8380,3,"Cystadenocarcinoma, endometrioid",alternate
8380,3,"Endometrioid carcinoma, NOS",alternate
8380,3,Endometrioid cystadenocarcinoma,alternate
8381,0,"Endometrioid adenofibroma, NOS (C56.9 [F], C61.9 [M])",preferred
8381,0,"Adenofibroma, endometrioid, NOS",alternate
8381,0,"Cystadenofibroma, endometrioid, NOS",alternate
8381,0,"Endometrioid cystadenofibroma, NOS",alternate
8381,1,"Endometrioid adenofibroma, borderline malignancy (C56.9 [F], C61.9 [M])",preferred
8381,1,"Adenofibroma, endometrioid, borderline malignancy",alternate
8381,1,"Cystadenofibroma, endometrioid, borderline malignancy",alternate
8381,1,"Endometrioid cystadenofibroma, borderline malignancy",alternate
8381,3,"Endometrioid adenofibroma, malignant (C56.9 [F], C61.9 [M])",preferred
8381,3,"Adenofibroma, endometrioid, malignant",alternate
8381,3,"Cystadenofibroma, endometrioid, malignant",alternate
8381,3,"Endometrioid cystadenofibroma, malignant",alternate
8382,2,"Endometrioid adenocarcinoma in situ, secretory variant",preferred
8382,3,"Endometrioid adenocarcinoma, secretory variant (C56.9 [F], C61.9 [M])",preferred
8382,3,"Adenocarcinoma, endometrioid, secretory variant",alternate
8382,3,"secretory variant, endometrioid adenocarcinoma",alternate
8383,3,"Endometrioid adenocarcinoma, ciliated cell variant (C56.9 [F], C61.9 [M])",preferred
8383,3,"Adenocarcinoma, endometrioid, ciliated cell variant",alternate
8383,3,"Ciliated cell variant, endometrioid adenocarcinoma",alternate
8384,2,"Adenocarcinoma, endocervical type, in situ (C53._)",preferred
8384,3,"Adenocarcinoma, endocervical type (C53._)",preferred
8384,3,Endocervical type adenocarcinoma,alternate
8390,0,Skin appendage adenoma (C44._),preferred
8390,0,"Skin appendage tumor, benign (C44._)",alternate
8390,0,"Tumor, adnexal, benign (C44._)",alternate
8390,0,"Tumor, skin appendage, benign (C44._)",alternate
8390,0,"Adenoma, skin appendage (C44._)",alternate
8390,0,"Adnexal tumor, benign (C44._)",alternate
8390,2,Skin appendage carcinoma in situ (C44._),preferred
8390,3,Skin appendage carcinoma (C44._),preferred
8390,3,"Adenocarcinoma, adnexal (C44._)",alternate
8390,3,Adnexal carcinoma (C44._),alternate
8390,3,"Carcinoma, adnexal (C44._)",alternate
8390,3,"Carcinoma, skin appendage (C44._)",alternate
8390,3,Skin appendage carcinoma (C44._),alternate
8391,0,Follicular fibroma (C44._),preferred
8391,0,Fibrofolliculoma (C44._),alternate
8391,0,"Fibroma, follicular (C44._)",alternate
8391,0,"Fibroma, perifollicular (C44._)",alternate
8391,0,Perifollicular fibroma (C44._),alternate
8391,0,Trichodiscoma (C44._),alternate
8392,0,Syringofibroadenoma (C44._),preferred
8400,0,Sweat gland adenoma (C44._),preferred
8400,0,"Syringadenoma, NOS (C44._)",alternate
8400,0,"Tumor, sweat gland, benign (C44._)",alternate
8400,0,"Adenoma, sweat gland (C44._)",alternate
8400,0,"Hidradenoma, NOS (C44._)",alternate
8400,0,"Sweat gland tumor, benign (C44._)",alternate
8400,1,"Sweat gland tumor, NOS (C44._)",preferred
8400,1,"Tumor, sweat gland, NOS (C44._)",alternate
8400,2,Sweat gland adenocarcinoma in situ (C44._),preferred
8400,3,Sweat gland adenocarcinoma (C44._),preferred
8400,3,"Adenocarcinoma, sweat gland (C44._)",alternate
8400,3,"Carcinoma, sweat gland (C44._)",alternate
8400,3,Sweat gland carcinoma (C44._),alternate
8400,3,"Sweat gland tumor, malignant (C44._)",alternate
8400,3,"Tumor, sweat gland, malignant (C44._)",alternate
8401,0,Apocrine adenoma (C44._),preferred
8401,0,"Adenoma, apocrine",alternate
8401,0,Apocrine cystadenoma,alternate
8401,0,"Cystadenoma, apocrine",alternate
8401,2,Apocrine adenocarcinoma in situ (C44._),preferred
8401,3,Apocrine adenocarcinoma (C44._),preferred
8401,3,"Adenocarcinoma, apocrine",alternate
8402,0,Nodular hidradenoma (C44._),preferred
8402,0,"Hidradenoma, nodular (C44._)",alternate
8402,0,"Acrospiroma, eccrine (C44._)",alternate
8402,0,Clear cell hidradenoma (C44._),alternate
8402,0,Eccrine acrospiroma (C44._),alternate
8402,0,"Hidradenoma, clear cell (C44._)",alternate
8402,2,"Nodular hidradenoma, in situ (C44._)",preferred
8402,3,"Nodular hidradenoma, malignant (C44._)",preferred
8402,3,"Hidradenoma, nodular, malignant (C44._)",alternate
8402,3,"Nodular hidradenoma, malignant (C44._)",alternate
8403,0,Eccrine spiradenoma (C44._),preferred
8403,0,"Spiradenoma, eccrine (C44._)",alternate
8403,0,"Spiradenoma, NOS (C44._)",alternate
8403,3,Malignant eccrine spiradenoma (C44._),preferred
8403,3,"Eccrine spiradenoma, malignant (C44._)",alternate
8403,3,"Spiradenoma, eccrine, malignant (C44._)",alternate
8404,0,Hidrocystoma (C44._),preferred
8404,0,"Cystadenoma, eccrine (C44._)",alternate
8404,0,Eccrine cystadenoma (C44._),alternate
8405,0,Papillary hidradenoma (C44._),preferred
8405,0,Hidradenoma papilliferum,alternate
8405,0,"Hidradenoma, papillary",alternate
8405,0,"Papilliferum, hidradenoma",alternate
8406,0,Papillary syringadenoma (C44._),preferred
8406,0,"Syringocystadenoma, papillary (C44._)",alternate
8406,0,Papillary syringocystadenoma (C44._),alternate
8406,0,"Papilliferum, syringocystadenoma",alternate
8406,0,"Syringadenoma, papillary (C44._)",alternate
8406,0,Syringocystadenoma papilliferum,alternate
8406,3,Syringocystadenocarcinoma papilliferum [2022+],preferred
8406,3,"Papilliferum, syringocystadenocarcinoma [2022+]",alternate
8407,0,"Syringoma, NOS (C44._)",preferred
8407,3,Sclerosing sweat duct carcinoma (C44._),preferred
8407,3,"Adnexal carcinoma, microcystic (C44._)",alternate
8407,3,"Adnexal microcystic, carcinoma (C44._)",alternate
8407,3,"Carcinoma, adnexal, microcystic (C44._)",alternate
8407,3,"Carcinoma, microcystic adnexal (C44._)",alternate
8407,3,"Carcinoma, sclerosing sweat duct (C44._)",alternate
8407,3,"Carcinoma, sweat duct, sclerosing (C44._)",alternate
8407,3,"Carcinoma, syringomatous (C44._)",alternate
8407,3,"Duct carcinoma, sclerosing sweat (C44._)",alternate
8407,3,Sclerosing sweat duct carcinoma (C44._),alternate
8407,3,"Sweat duct carcinoma, sclerosing (C44._)",alternate
8407,3,Syringomatous carcinoma (C44._),alternate
8408,0,Eccrine papillary adenoma (C44._),preferred
8408,0,"Adenoma, eccrine papillary (C44._)",alternate
8408,0,"Adenoma, papillary, eccrine (C44._)",alternate
8408,0,"Eccrine adenoma, papillary (C44._)",alternate
8408,0,"Papillary adenoma, eccrine (C44._)",alternate
8408,1,Aggressive digital papillary adenoma (C44._),preferred
8408,1,"Adenoma, aggressive digital papillary (C44._) [PRE-2021 NOT REPORTABLE; FOR 2021+ USE CODE 8408/3.]",alternate
8408,1,"Adenoma, digital papillary, aggressive (C44._) [PRE-2021 NOT REPORTABLE; FOR 2021+ USE CODE 8408/3.]",alternate
8408,1,"Adenoma, papillary, aggressive digital (C44._) [PRE-2021 NOT REPORTABLE; FOR 2021+ USE CODE 8408/3.]",alternate
8408,1,"Aggressive papillary adenoma, digital (C44._) [PRE-2021 NOT REPORTABLE; FOR 2021+ USE CODE 8408/3.]",alternate
8408,1,"Digital papillary adenoma, aggressive (C44._) [PRE-2021 NOT REPORTABLE; FOR 2021+ USE CODE 8408/3.]",alternate
8408,1,"Papillary adenoma, aggressive digital (C44._) [PRE-2021 NOT REPORTABLE; FOR 2021+ USE CODE 8408/3.]",alternate
8408,3,Eccrine papillary adenocarcinoma (C44._),preferred
8408,3,"Eccrine adenocarcinoma, papillary (C44._)",alternate
8408,3,Eccrine papillary adenocarcinoma (C44._),alternate
8408,3,"Papillary adenocarcinoma, digital (C44._)",alternate
8408,3,"Papillary adenocarcinoma, eccrine (C44._)",alternate
8408,3,"Papillary adenoma, aggressive digital (C44._) [REPORTABLE 2021+]",alternate
8408,3,"Adenocarcinoma, digital papillary (C44._)",alternate
8408,3,"Adenocarcinoma, eccrine papillary (C44._)",alternate
8408,3,"Adenocarcinoma, papillary digital (C44._)",alternate
8408,3,"Adenocarcinoma, papillary eccrine (C44._)",alternate
8408,3,"Adenoma, aggressive digital papillary (C44._) [REPORTABLE 2021+; FOR PRE-2021, USE CODE 8408/1]",alternate
8408,3,"Adenoma, digital papillary, aggressive (C44._) [REPORTABLE 2021+; FOR PRE-2021, USE CODE 8408/1]",alternate
8408,3,"Adenoma, papillary, aggressive digital (C44._) [REPORTABLE 2021+; FOR PRE-2021, USE CODE 8408/1]",alternate
8408,3,"Aggressive digital papillary adenoma (C44._) [REPORTABLE 2021+; FOR PRE-2021, USE CODE 8408/1]",alternate
8408,3,"Aggressive papillary adenoma, digital (C44._) [REPORTABLE 2021+; FOR PRE-2021, USE CODE 8408/1]",alternate
8408,3,"Digital papillary adenoma, aggressive (C44._) [REPORTABLE 2021+; FOR PRE-2021, USE CODE 8408/1]",alternate
8409,0,Eccrine poroma (C44._),preferred
8409,0,"Poroma, eccrine (C44._)",alternate
8409,2,Porocarcinoma in situ [2022+],preferred
8409,2,In situ porocarcinoma [2022+],alternate
8409,3,"Eccrine poroma, malignant (C44._)",preferred
8409,3,"Eccrine poroma, malignant (C44._)",alternate
8409,3,"Poroma, eccrine, malignant (C44._)",alternate
8410,0,Sebaceous adenoma (C44._),preferred
8410,0,"Adenoma, sebaceous (C44._)",alternate
8410,0,"Epithelioma, sebaceous (C44._)",alternate
8410,0,Sebaceous epithelioma (C44._),alternate
8410,2,Sebaceous adenocarcinoma in situ (C44._),preferred
8410,3,Sebaceous adenocarcinoma (C44._),preferred
8410,3,"Adenocarcinoma, sebaceous (C44._)",alternate
8410,3,"Carcinoma, sebaceous (C44._)",alternate
8410,3,Sebaceous adenocarcinoma (C44._),alternate
8413,3,Eccrine adenocarcinoma (C44._),preferred
8413,3,"Adenocarcinoma, eccrine, NOS (C44._)",alternate
8420,0,Ceruminous adenoma (C44.2),preferred
8420,3,Ceruminous adenocarcinoma (C44.2),preferred
8420,3,"Adenoma, ceruminous (C44.2)",alternate
8420,3,"Carcinoma, ceruminous (C44.2)",alternate
8420,3,Ceruminous carcinoma (C44.2),alternate
8420,3,"Adenocarcinoma, ceruminous (C44.2)",alternate
8430,1,Mucoepidermoid tumor [OBS],preferred
8430,1,"Tumor, mucoepidermoid [obs]",alternate
8430,2,Mucoepidermoid carcinoma in situ,preferred
8430,3,Mucoepidermoid carcinoma,preferred
8430,3,"Carcinoma, mucoepidermoid",alternate
8440,0,"Cystadenoma, NOS",preferred
8440,0,"Cystoma, NOS",alternate
8440,2,"Cystadenocarcinoma, in situ",preferred
8440,3,"Cystadenocarcinoma, NOS",preferred
8441,0,"Serous cystadenoma, NOS (C56.9)",preferred
8441,0,"Adenoma, microcystic, serous",alternate
8441,0,"Adenoma, serous microcystic",alternate
8441,0,"Cystadenoma, serous, NOS",alternate
8441,0,"Cystoma, serous",alternate
8441,0,"Microcystic adenoma, serous",alternate
8441,0,"Serous adenoma, microcystic",alternate
8441,0,Serous cystoma,alternate
8441,0,Serous microcystic adenoma,alternate
8441,2,"Serous cystadenoma in situ, NOS (C56.9)",preferred
8441,2,"Carcinoma, serous endometrial [tubal] intraepithelial (C54._, C55.9 [C57.0])",alternate
8441,2,"Endometrial intraepithelial carcinoma, serous (C54._, C55.9)",alternate
8441,2,"Intraepithelial carcinoma, serous endometrial (C54._, C55.9)",alternate
8441,2,"Intraepithelial carcinoma, serous tubal (C57.0)",alternate
8441,2,"Intraepithelial serous endometrial [tubal] carcinoma (C54._, C55.9 [C57.0])",alternate
8441,2,"Serous endometrial intraepithelial carcinoma (C54._, C55.9)",alternate
8441,2,Serous tubal intraepithelial carcinoma (C57.0),alternate
8441,2,"Tubal intraepithelial carcinoma, serous (C57.0)",alternate
8441,2,"Carcinoma, intraepithelial, serous endometrial (C54._, C55.9)",alternate
8441,2,"Carcinoma, intraepithelial, serous tubal (C57.0)",alternate
8441,3,"Serous cystadenocarcinoma, NOS (C56.9)",preferred
8441,3,"Adenocarcinoma, papillary, serous (C56.9) [2021+. FOR PRE-2021, USE CODE 8460/3.]",alternate
8441,3,"Adenocarcinoma, serous, NOS",alternate
8441,3,"Adenocarcinoma, serous, papillary (C56.9) [2021+. FOR PRE-2021, USE CODE 8460/3.]",alternate
8441,3,"Carcinoma, papillary, serous surface (C56.9) [2021+. FOR PRE-2021, USE CODE 8461/3.]",alternate
8441,3,"Carcinoma, serous surface papillary (C56.9) [2021+. FOR PRE-2021, USE CODE 8461/3.]",alternate
8441,3,"Carcinoma, serous, NOS",alternate
8441,3,"Cystadenocarcinoma, papillary serous (C56.9) [2021+. FOR PRE-2021, USE CODE 8460/3.]",alternate
8441,3,"Cystadenocarcinoma, serous, NOS (C56.9)",alternate
8441,3,"Papillary adenocarcinoma, serous (C56.9) [2021+. FOR PRE-2021, USE CODE 8460/3.]",alternate
8441,3,"Papillary carcinoma, serous surface (C56.9) [2021+. FOR PRE-2021, USE CODE 8461/3.]",alternate
8441,3,"Papillary cystadenocarcinoma, serous (C56.9) [2021+. FOR PRE-2021, USE CODE 8460/3.]",alternate
8441,3,"Papillary serous adenocarcinoma (C56.9) [2021+. FOR PRE-2021, USE CODE 8460/3.]",alternate
8441,3,"Papillary serous cystadenocarcinoma (C56.9) [2021+. FOR PRE-2021, USE CODE 8460/3.]",alternate
8441,3,"Serous adenocarcinoma, NOS",alternate
8441,3,"Serous adenocarcinoma, papillary (C56.9) [2021+. FOR PRE-2021, USE CODE 8460/3.]",alternate
8441,3,"Serous cystadenocarcinoma, NOS (C56.9)",alternate
8441,3,"Serous cystadenocarcinoma, papillary (C56.9) [2021+. FOR PRE-2021, USE CODE 8460/3.]",alternate
8441,3,"Serous surface carcinoma, papillary (C56.9) [2021+. FOR PRE-2021, USE CODE 8461/3.]",alternate
8441,3,"Serous surface papillary carcinoma (C56.9) [2021+. FOR PRE-2021, USE CODE 8461/3.]",alternate
8441,3,"Surface papillary carcinoma, serous (C56.9) [2021+. FOR PRE-2021, USE CODE 8461/3.]",alternate
8442,1,"Serous cystadenoma, borderline malignancy (C56.9)",preferred
8442,1,"Serous tumor, atypical proliferating (C56.9)",alternate
8442,1,"Serous tumor, NOS, of low malignant potential (C56.9)",alternate
8442,1,"Tumor, serous, atypical proliferating (C56.9)",alternate
8442,1,"Tumor, serous, NOS, of low malignant potential (C56.9)",alternate
8442,1,Atypical proliferating serous tumor (C56.9),alternate
8442,1,"Cystadenoma, serous, borderline malignancy (C56.9)",alternate
8442,1,"Low malignant potential, serous tumor, NOS (C56.9)",alternate
8442,1,"Proliferating serous tumor, atypical (C56.9)",alternate
8442,2,Proliferating serous carcinoma in situ (C56.9),preferred
8442,3,Papillary serous carcinoma malignant,preferred
8443,0,Clear cell cystadenoma (C56.9),preferred
8443,0,"Cystadenoma, clear cell (C56.9)",alternate
8443,3,Clear cell cystadenocarcinoma (C56.9),preferred
8444,3,"Clear cell cystic tumor, malignant (C56.9)",preferred
8450,0,"Papillary cystadenoma, NOS (C56.9)",preferred
8450,0,"Cystadenoma, papillary, NOS (C56.9)",alternate
8450,2,"Papillary cystadenocarcinoma in situ, NOS (C56.9)",preferred
8450,3,"Papillary cystadenocarcinoma, NOS (C56.9)",preferred
8450,3,"Adenocarcinoma, papillocystic",alternate
8450,3,"Cystadenocarcinoma, papillary, NOS (C56.9)",alternate
8450,3,Papillocystic adenocarcinoma,alternate
8451,1,"Papillary cystadenoma, borderline malignancy (C56.9)",preferred
8451,1,"Cystadenoma, papillary, borderline malignancy (C56.9)",alternate
8452,1,Solid pseudopapillary tumor (C25._),preferred
8452,1,Cystic and solid tumor (C25._),alternate
8452,1,"Cystic papillary, tumor (C25._)",alternate
8452,1,"Cystic tumor, papillary (C25._)",alternate
8452,1,"Epithelial neoplasm, solid and papillary (C25._)",alternate
8452,1,"Neoplasm, papillary and solid epithelial (C25._)",alternate
8452,1,"Neoplasm, solid and papillary epithelial (C25._)",alternate
8452,1,Papillary cystic tumor (C25._),alternate
8452,1,"Papillary epithelial neoplasm, solid and (C25._)",alternate
8452,1,Solid and cystic tumor (C25._),alternate
8452,1,Solid and papillary epithelial neoplasm (C25._),alternate
8452,1,Solid pseudopapillary tumor (C25._),alternate
8452,1,"Tumor, cystic and solid (C25._)",alternate
8452,1,"Tumor, cystic, papillary (C25._)",alternate
8452,1,"Tumor, papillary cystic (C25._)",alternate
8452,1,"Tumor, pseudopapillary, solid (C25._)",alternate
8452,1,"Tumor, pseudopapillary, solid (C56.9)",alternate
8452,1,"Tumor, solid and cystic (C25._)",alternate
8452,3,Solid pseudopapillary carcinoma (C25._),preferred
8452,3,"Carcinoma, solid, pseudopapillary (C25._)",alternate
8452,3,"Neoplasm, solid pseudopapillary (C25._) [REPORTABLE 2021+]",alternate
8452,3,Solid pseudopapillary carcinoma (C25._),alternate
8452,3,Solid pseudopapillary tumor (C25._) [REPORTABLE 2021+],alternate
8452,3,"Tumor, pseudopapillary, solid (C25._) [REPORTABLE 2021+]",alternate
8453,0,Intraductal papillary-mucinous adenoma (C25._),preferred
8453,0,"Adenoma, intraductal papillary-mucinous (C25._)",alternate
8453,0,"Adenoma, mucinous-papillary, intraductal (C25._)",alternate
8453,0,"Adenoma, papillary-mucinous, intraductal (C25._)",alternate
8453,0,"Dysplasia, intraductal papillary-mucinous tumor with moderate (C25._)",alternate
8453,0,Intraductal papillary-mucinous tumor with moderate dysplasia (C25._),alternate
8453,0,"Moderate dysplasia, intraductal papillary-mucinous tumor with (C25._)",alternate
8453,0,"Mucinous-papillary adenoma, intraductal (C25._)",alternate
8453,0,"Mucinous-papillary tumor, intraductal, with moderate dysplasia (C25._)",alternate
8453,0,"Papillary-mucinous tumor, intraductal, with moderate dysplasia (C25._)",alternate
8453,0,"Tumor, intraductal papillary-mucinous, with moderate dysplasia (C25._)",alternate
8453,0,"Tumor, mucinous-papillary, intraductal, with moderate dysplasia (C25._)",alternate
8453,0,"Tumor, papillary-mucinous, intraductal, with moderate dysplasia (C25._)",alternate
8453,2,"Intraductal papillary-mucinous carcinoma, non-invasive (C25._)",preferred
8453,2,"Non-invasive carcinoma, intraductal papillary-mucinous (C25._)",alternate
8453,2,"Papillary mucinous carcinoma, intraductal, non-invasive (C25._)",alternate
8453,2,"Papillary mucinous neoplasm, Intraductal with high-grade dysplasia (C25._)",alternate
8453,2,"Carcinoma, papillary-mucinous, intraductal, non-invasive (C25._)",alternate
8453,2,Intraductal papillary mucinous neoplasm with high-grade dysplasia (C25._),alternate
8453,2,"Mucinous papillary carcinoma, intraductal, non-invasive (C25._)",alternate
8453,2,"Mucinous papillary neoplasm, Intraductal with high-grade dysplasia (C25._)",alternate
8453,3,"Intraductal papillary-mucinous carcinoma, invasive (C25._)",preferred
8453,3,"Carcinoma, invasive, associated with intraductal papillary mucinous neoplasm (IPMN) (C25._)",alternate
8453,3,Intraductal papillary-mucinous neoplasm (IPMN) with an associated invasive carcinoma (C25._),alternate
8453,3,Invasive intraductal papillary-mucinous carcinoma (C25._),alternate
8453,3,IPMN (intraductal papillary mucinous neoplasm) with an associated invasive carcinoma (C25._),alternate
8453,3,"Mucinous papillary neoplasm, Intraductal (IPMN) with an associated invasive carcinoma (C25._)",alternate
8453,3,"Mucinous-papillary carcinoma, intraductal, invasive (C25._)",alternate
8453,3,"Papillary mucinous neoplasm, Intraductal (IPMN) with an associated invasive carcinoma (C25._)",alternate
8453,3,"Papillary-mucinous carcinoma, intraductal, invasive (C25._)",alternate
8454,0,Cystic tumor of atrio-ventricular node (C38.0),preferred
8454,0,"Tumor, cystic, atrio-ventricular node (C38.0)",alternate
8455,2,"Intraductal oncocytic papillary neoplasm, NOS (C25._) [2022+]",preferred
8455,2,"Neoplasm, intraductal oncocytic papillary, NOS (C25._) [2022+]",alternate
8455,3,Intraductal oncocytic papillary neoplasm with associated invasive carcinoma (C25._) [2022+],preferred
8455,3,"Neoplasm, intraductal oncocytic papillary, with associated invasive carcinoma (C25._) [2022+]",alternate
8460,0,"Papillary serous cystadenoma, NOS (C56.9)",preferred
8460,0,"Cystadenoma, papillary serous, NOS (C56.9)",alternate
8460,0,"Papillary cystadenoma, serous, NOS (C56.9)",alternate
8460,0,"Serous cystadenoma, papillary, NOS (C56.9)",alternate
8460,2,"Papillary serous cystadenocarcinoma in situ, NOS (C56.9)",preferred
8460,2,"Micropapillary variant, serous borderline tumor (C56.9) [2018+ CASES ONLY; NOT REPORTABLE]",alternate
8460,2,Serous borderline tumor-micropapillary variant (C56.9) [2018+ CASES ONLY; NOT REPORTABLE],alternate
8460,2,"Serous carcinoma, non-invasive low grade (C56.9)",alternate
8460,2,"Tumor, serous borderline-micropapillary variant (C56.9) [2018+ CASES ONLY; NOT REPORTABLE]",alternate
8460,2,"Tumor, serous borderline-micropapillary variant (C56.9) [2018+ CASES ONLY; NOT REPORTABLE]",alternate
8460,2,"Carcinoma, non-invasive low grade serous (C56.9)",alternate
8460,3,Papillary serous cystadenocarcinoma (C56.9),preferred
8460,3,"Adenocarcinoma, papillary, serous (C56.9) [PRE-2021 ONLY. FOR 2021+ USE CODE 8441/3.]",alternate
8460,3,"Adenocarcinoma, serous, papillary (C56.9) [PRE-2021 ONLY. FOR 2021+ USE CODE 8441/3.]",alternate
8460,3,"Carcinoma, micropapillary serous (C56.9)",alternate
8460,3,"Carcinoma, serous, Low-grade (C56.9, C48._, C57.0, C57.1–C57.3)",alternate
8460,3,"Cystadenocarcinoma, papillary serous (C56.9) [PRE-2021 ONLY. FOR 2021+ USE CODE 8441/3.]",alternate
8460,3,Micropapillary serous carcinoma (C56.9),alternate
8460,3,"Papillary adenocarcinoma, serous (C56.9) [PRE-2021 ONLY. FOR 2021+ USE CODE 8441/3.]",alternate
8460,3,"Papillary cystadenocarcinoma, serous (C56.9) [PRE-2021 ONLY. FOR 2021+ USE CODE 8441/3.]",alternate
8460,3,Papillary serous adenocarcinoma (C56.9) [PRE-2021 ONLY. FOR 2021+ USE CODE 8441/3.],alternate
8460,3,Papillary serous cystadenocarcinoma (C56.9) [PRE-2021 ONLY. FOR 2021+ USE CODE 8441/3.],alternate
8460,3,"Serous adenocarcinoma, papillary (C56.9) [PRE-2021 ONLY. FOR 2021+ USE CODE 8441/3.]",alternate
8460,3,"Serous carcinoma, low-grade (C56.9, C48._, C57.0, C57.1–C57.3)",alternate
8460,3,"Serous carcinoma, micropapillary (C56.9)",alternate
8460,3,"Serous cystadenocarcinoma, papillary (C56.9) [PRE-2021 ONLY. FOR 2021+ USE CODE 8441/3.]",alternate
8461,0,Serous surface papilloma (C56.9),preferred
8461,0,"Papilloma, serous surface (C56.9)",alternate
8461,0,"Surface papilloma, serous (C56.9)",alternate
8461,2,"Serous surface papilloma, in situ (C56.9)",preferred
8461,3,Serous surface papillary carcinoma (C56.9),preferred
8461,3,"Serous papillary carcinoma, primary, peritoneum (C48.1)",alternate
8461,3,"Serous surface carcinoma, papillary (C56.9) [PRE-2021 ONLY. FOR 2021+ USE CODE 8441/3.]",alternate
8461,3,Serous surface papillary carcinoma (C56.9) [PRE-2021 ONLY. FOR 2021+ USE CODE 8441/3.],alternate
8461,3,"Surface papillary carcinoma, serous (C56.9) [PRE-2021 ONLY. FOR 2021+ USE CODE 8441/3.]",alternate
8461,3,"Carcinoma, papillary serous, primary, peritoneum (C48.1)",alternate
8461,3,"Carcinoma, papillary, serous surface (C56.9) [PRE-2021 ONLY. FOR 2021+ USE CODE 8441/3.]",alternate
8461,3,"Carcinoma, primary serous papillary, peritoneum (C48.1)",alternate
8461,3,"Carcinoma, serous papillary, primary, peritoneum (C48.1)",alternate
8461,3,"Carcinoma, serous surface papillary (C56.9) [PRE-2021 ONLY. FOR 2021+ USE CODE 8441/3.]",alternate
8461,3,"Carcinoma, serous, high-grade (C48._, C56.9, C57.0, C57.1–C57.3)",alternate
8461,3,"Papillary carcinoma, primary serous, peritoneum (C48.1)",alternate
8461,3,"Papillary carcinoma, serous surface (C56.9) [PRE-2021 ONLY. FOR 2021+ USE CODE 8441/3.]",alternate
8461,3,"Papillary primary serous carcinoma, peritoneum (C48.1)",alternate
8461,3,Primary serous papillary carcinoma of peritoneum (C48.1),alternate
8461,3,"Serous carcinoma, high-grade (C48._, C56.9, C57.0, C57.1–C57.3)",alternate
8462,1,"Serous papillary cystic tumor, borderline malignancy (C56.9)",preferred
8462,1,Atypical proliferative papillary serous tumor (C56.9),alternate
8462,1,"Cystadenoma, papillary serous, borderline malignancy (C56.9)",alternate
8462,1,"Cystic serous papillary, tumor, borderline malignancy (C56.9)",alternate
8462,1,"Cystic tumor, serous papillary, borderline malignancy (C56.9)",alternate
8462,1,"Low malignant potential, papillary serous tumor (C56.9)",alternate
8462,1,"Papillary cystadenoma, serous, borderline malignancy (C56.9)",alternate
8462,1,"Papillary cystic tumor, serous, borderline malignancy (C56.9)",alternate
8462,1,"Papillary serous cystadenoma, borderline malignancy (C56.9)",alternate
8462,1,Papillary serous tumor of low malignant potential (C56.9),alternate
8462,1,"Papillary serous tumor, atypical proliferative (C56.9)",alternate
8462,1,"Proliferative papillary serous tumor, atypical (C56.9)",alternate
8462,1,"Serous cystadenoma, papillary, borderline malignancy (C56.9)",alternate
8462,1,"Serous tumor, papillary, atypical proliferating (C56.9)",alternate
8462,1,"Serous tumor, papillary, of low malignant potential (C56.9)",alternate
8462,1,"Tumor, papillary serous, of low malignant potential (C56.9)",alternate
8462,1,"Tumor, papillary, serous, atypical proliferative (C56.9)",alternate
8462,1,"Tumor, serous, papillary cystic, of borderline malignancy (C56.9)",alternate
8462,1,"Tumor, serous, papillary, of low malignant potential (C56.9)",alternate
8463,1,Serous surface papillary tumor of borderline malignancy (C56.9),preferred
8463,1,"Surface papillary tumor, serous surface, borderline malignancy (C56.9)",alternate
8463,1,"Tumor, serous surface papillary, of borderline malignancy (C56.9)",alternate
